"oid","nombre","origen","anyo_fundacion","descripcion","enlace"
1,"Audi","Alemania","1930","Marca líder en automóviles deportivos.","www.audi.es"
2,"Volkswagen","Alemania","1944","Marca destaca en diseños alemanes.","www.volskwagen.de"
3,"Ferrari","Italia","1966","Marca de referencia en el diseño estético automovilístico.","www.ferrary.it"
4,"Mercedes","Alemania","1974","Gama alta de automóviles.","www.mercedes.es"
5,"Ford","Estados Unidos","1955","Gama líder en relación calidad-precio.","www.ford.com"
